[
  {
    "node_id": "node_1",
    "node_type": "CORRIDOR",
    "name": "Hormuz Strait",
    "lat": 26.5,
    "lon": 56.5,
    "capacity_mbpd": 2.65
  },
  {
    "node_id": "node_2",
    "node_type": "CORRIDOR",
    "name": "Bab-el-Mandeb",
    "lat": 12.6,
    "lon": 43.3,
    "capacity_mbpd": 4.64
  },
  {
    "node_id": "node_3",
    "node_type": "CORRIDOR",
    "name": "Malacca Strait",
    "lat": 1.3,
    "lon": 103.8,
    "capacity_mbpd": 2.89
  },
  {
    "node_id": "node_4",
    "node_type": "PORT",
    "name": "JNPT Mumbai",
    "lat": 18.9,
    "lon": 72.8,
    "capacity_mbpd": 0.76
  },
  {
    "node_id": "node_5",
    "node_type": "PORT",
    "name": "Chennai Port",
    "lat": 13.1,
    "lon": 80.3,
    "capacity_mbpd": 2.79
  },
  {
    "node_id": "node_6",
    "node_type": "PORT",
    "name": "Kandla Port",
    "lat": 22.5,
    "lon": 69.7,
    "capacity_mbpd": 4.33
  },
  {
    "node_id": "node_7",
    "node_type": "REFINERY",
    "name": "Mumbai Refinery Complex",
    "lat": 19.0,
    "lon": 73.0,
    "capacity_mbpd": 0.81
  },
  {
    "node_id": "node_8",
    "node_type": "REFINERY",
    "name": "Chennai Refinery",
    "lat": 13.0,
    "lon": 80.2,
    "capacity_mbpd": 0.81
  },
  {
    "node_id": "node_9",
    "node_type": "DEMAND_CENTER",
    "name": "North India Demand Hub",
    "lat": 28.6,
    "lon": 77.2,
    "capacity_mbpd": 4.38
  },
  {
    "node_id": "node_10",
    "node_type": "DEMAND_CENTER",
    "name": "South India Demand Hub",
    "lat": 17.4,
    "lon": 78.5,
    "capacity_mbpd": 2.32
  },
  {
    "node_id": "node_11",
    "node_type": "PRODUCTION_FIELD",
    "name": "Gulf Production Aggregate",
    "lat": 25.2,
    "lon": 55.3,
    "capacity_mbpd": 4.74
  },
  {
    "node_id": "node_12",
    "node_type": "PRODUCTION_FIELD",
    "name": "Arabian Production Aggregate",
    "lat": 30.0,
    "lon": 48.0,
    "capacity_mbpd": 3.06
  }
]